ID,Title,Vulnerability_Mapping,Abstraction,Description,Impact,Mitigation,Comments,Alternate_Terms
257,Storing Passwords in a Recoverable Format,ALLOWED,Base,"The storage of passwords in a recoverable format makes them subject to password reuse attacks by malicious users. In fact, it should be noted that recoverable encrypted passwords provide no significant benefit over plaintext passwords since they are subject not only to reuse by malicious attackers but also by malicious insiders. If a system administrator can recover a password directly, or use a brute force search on the available information, the administrator can use the password on other accounts.","Gain Privileges or Assume Identity
Scope: Confidentiality, Access Control User's passwords may be revealed.

Gain Privileges or Assume Identity
Scope: Access Control Revealed passwords may be reused elsewhere to impersonate the users in question.","Use strong, non-reversible encryption to protect stored passwords.",Carefully read both the name and description to ensure that this mapping is an appropriate fit. Do not try to 'force' a mapping to a lower-level Base/Variant simply to comply with this preferred level of abstraction.,N/A
259,Use of Hard-coded Password,ALLOWED,Variant,"The product contains a hard-coded password, which it uses for its own inbound authentication or for outbound communication to external components.

There are two main variations of a hard-coded password:

Inbound: the product contains an authentication mechanism that checks for a hard-coded password.
Outbound: the product connects to another system or component, and it contains a hard-coded password for connecting to that component.","Gain Privileges or Assume Identity
Scope: Access Control If hard-coded passwords are used, it is almost certain that malicious users can gain access through the account in question.

Gain Privileges or Assume Identity; Hide Activities; Reduce Maintainability
Scope: Access Control A hard-coded password typically leads to a significant authentication failure that can be difficult for the system administrator to detect. Once detected, it can be difficult to fix, so the administrator may be forced into disabling the product entirely.","For outbound authentication: store passwords outside of the code in a strongly-protected, encrypted configuration file or database that is protected from access by all outsiders, including other local users on the same system. Properly protect the key ( CWE-320 ). If you cannot use encryption to protect the file, then make sure that the permissions are as restrictive as possible.

For inbound authentication: Rather than hard-code a default username and password for first time logins, utilize a ""first login"" mode that requires the user to enter a unique strong password.

Perform access control checks and limit which entities can access the feature that requires the hard-coded password. For example, a feature might only be enabled through the system console instead of through a network connection.

For inbound authentication: apply strong one-way hashes to your passwords and store those hashes in a configuration file or database with appropriate access control. That way, theft of the file/database still requires the attacker to try to crack the password. When receiving an incoming password during authentication, take the hash of the password and compare it to the hash that you have saved. Use randomly assigned salts for each separate hash that you generate. This increases the amount of computation that an attacker needs to conduct a brute-force attack, possibly limiting the effectiveness of the rainbow table method.

For front-end to back-end connections: Three solutions are possible, although none are complete. The first suggestion involves the use of generated passwords which are changed automatically and must be entered at given time intervals by a system administrator. These passwords will be held in memory and only be valid for the time intervals. Next, the passwords used should be limited at the back end to only performing actions valid for the front end, as opposed to having full access. Finally, the messages sent should be tagged and checksummed with time sensitive values so as to prevent replay style attacks.",Carefully read both the name and description to ensure that this mapping is an appropriate fit. Do not try to 'force' a mapping to a lower-level Base/Variant simply to comply with this preferred level of abstraction.,N/A
263,Password Aging with Long Expiration,DISCOURAGED,Base,"The product supports password aging, but the expiration period is too long.

Password aging (or password rotation) is a policy that forces users to change their passwords after a defined time period passes, such as every 30 or 90 days. A long expiration provides more time for attackers to conduct password cracking before users are forced to change to a new password.
Note that while password aging was once considered an important security feature, it has since fallen out of favor by many, because it is not as effective against modern threats compared to other mechanisms such as slow hashes. In addition, forcing frequent changes can unintentionally encourage users to select less-secure passwords. However, password aging is still in use due to factors such as compliance requirements, e.g., Payment Card Industry Data Security Standard (PCI DSS).","Gain Privileges or Assume Identity
Scope: Access Control As passwords age, the probability that they are compromised grows.","Previously, ""password expiration"" was
			   widely advocated as a defense-in-depth approach to
			   minimize the risk of weak passwords, and it has become
			   a common practice.  Password expiration requires a
			   password to be changed within a fixed time window (such
			   as every 90 days).  However, this approach has
			   significant limitations in the current threat
			   landscape, and its utility has been reduced in light of
			   the adoption of related protection mechanisms (such as
			   password complexity and computational effort), along
			   with the recognition that regular password changes
			   often caused users to generate more predictable
			   passwords. As a result, this is now a Discouraged
			   Common Practice [ REF-1488 ] [ REF-1489 ], especially as
			   the sole factor in protecting passwords. It is still
			   strongly encouraged to force password changes in case
			   of evidence of compromise, but this is not the same as
			   a forced ""expiration"" on an arbitrary time
			   frame.

Ensure that password aging is limited so that there is a defined maximum age for passwords. Note that if the expiration window is too short, it can cause users to generate poor or predictable passwords.

Ensure that the user is notified several times leading up to the password expiration.

Create mechanisms to prevent users from reusing passwords or creating similar passwords.

Developers might disable clipboard paste operations into password fields as a way to discourage users from pasting a password into a clipboard. However, this might encourage users to choose less-secure passwords that are easier to type, and it can reduce the usability of password managers [ REF-1294 ]. Effectiveness: Discouraged Common Practice","Consider CWEs related to the reliance on
            passwords or single-factor authentication, or other CWEs
            involving weak passwords.",N/A
267,Privilege Defined With Unsafe Actions,ALLOWED,Base,"A particular privilege, role, capability, or right can be used to perform unsafe actions that were not intended, even when it is assigned to the correct entity.","Gain Privileges or Assume Identity
Scope: Access Control A user can access restricted functionality and/or sensitive information that may include administrative functionality and user accounts.","Very carefully manage the setting, management, and handling of privileges. Explicitly manage trust zones in the software.

Strategy: Environment Hardening Run your code using the lowest privileges that are required to accomplish the necessary tasks [ REF-76 ]. If possible, create isolated accounts with limited privileges that are only used for a single task. That way, a successful attack will not immediately give the attacker access to the rest of the software or its environment. For example, database applications rarely need to run as the database administrator, especially in day-to-day operations.",Carefully read both the name and description to ensure that this mapping is an appropriate fit. Do not try to 'force' a mapping to a lower-level Base/Variant simply to comply with this preferred level of abstraction.,N/A
269,Improper Privilege Management,DISCOURAGED,Class,"The product does not properly assign, modify, track, or check privileges for an actor, creating an unintended sphere of control for that actor.","Gain Privileges or Assume Identity
Scope: Access Control","Very carefully manage the setting, management, and handling of privileges. Explicitly manage trust zones in the software.

Strategy: Separation of Privilege Follow the principle of least privilege when assigning access rights to entities in a software system.

Strategy: Separation of Privilege Consider following the principle of separation of privilege. Require multiple conditions to be met before permitting access to a system resource.","If an error or mistake allows privilege escalation, then use the CWE ID for that mistake. Avoid using CWE-269 when only phrases such as ""privilege escalation"" or ""gain privileges"" are available, as these indicate technical impact of the vulnerability - not the root cause weakness. If the root cause seems to be directly related to privileges, then examine the children of CWE-269 for additional hints, such as Execution with Unnecessary Privileges ( CWE-250 ) or Incorrect Privilege Assignment ( CWE-266 ).",N/A
271,Privilege Dropping / Lowering Errors,ALLOWED,Class,"The product does not drop privileges before passing control of a resource to an actor that does not have those privileges.

In some contexts, a system executing with elevated permissions will hand off a process/file/etc. to another process or user. If the privileges of an entity are not reduced, then elevated privileges are spread throughout a system and possibly to an attacker.","Gain Privileges or Assume Identity
Scope: Access Control If privileges are not dropped, neither are access rights of the user. Often these rights can be prevented from being dropped.

Gain Privileges or Assume Identity; Hide Activities
Scope: Access Control, Non-Repudiation If privileges are not dropped, in some cases the system may record actions as the user which is being impersonated rather than the impersonator.","Strategy: Separation of Privilege Compartmentalize the system to have ""safe"" areas where trust boundaries can be unambiguously drawn. Do not allow sensitive data to go outside of the trust boundary and always be careful when interfacing with a compartment outside of the safe area. Ensure that appropriate compartmentalization is built into the system design, and the compartmentalization allows for and reinforces privilege separation functionality. Architects and designers should rely on the principle of least privilege to decide the appropriate time to use privileges and the time to drop privileges.

Very carefully manage the setting, management, and handling of privileges. Explicitly manage trust zones in the software.

Strategy: Separation of Privilege Consider following the principle of separation of privilege. Require multiple conditions to be met before permitting access to a system resource.",Examine children of this entry to see if there is a better fit,N/A
272,Least Privilege Violation,ALLOWED,Base,The elevated privilege level required to perform operations such as chroot() should be dropped immediately after the operation is performed.,"Gain Privileges or Assume Identity; Read Application Data; Read Files or Directories
Scope: Access Control, Confidentiality An attacker may be able to access resources with the elevated privilege that could not be accessed with the attacker's original privileges. This is particularly likely in conjunction with another flaw, such as a buffer overflow.","Very carefully manage the setting, management, and handling of privileges. Explicitly manage trust zones in the software.

Strategy: Separation of Privilege Follow the principle of least privilege when assigning access rights to entities in a software system.

Strategy: Separation of Privilege Compartmentalize the system to have ""safe"" areas where trust boundaries can be unambiguously drawn. Do not allow sensitive data to go outside of the trust boundary and always be careful when interfacing with a compartment outside of the safe area. Ensure that appropriate compartmentalization is built into the system design, and the compartmentalization allows for and reinforces privilege separation functionality. Architects and designers should rely on the principle of least privilege to decide the appropriate time to use privileges and the time to drop privileges.",Carefully read both the name and description to ensure that this mapping is an appropriate fit. Do not try to 'force' a mapping to a lower-level Base/Variant simply to comply with this preferred level of abstraction.,N/A
274,Improper Handling of Insufficient Privileges,DISCOURAGED,Base,"The product does not handle or incorrectly handles when it has insufficient privileges to perform an operation, leading to resultant weaknesses.","Other; Alter Execution Logic
Scope: Other",N/A,See maintenance notes.,N/A
276,Incorrect Default Permissions,ALLOWED,Base,"During installation, installed file permissions are set to allow anyone to modify those files.","Read Application Data; Modify Application Data
Scope: Confidentiality, Integrity","The architecture needs to access and modification attributes for files to only those users who actually require those actions.

Strategy: Separation of Privilege Compartmentalize the system to have ""safe"" areas where trust boundaries can be unambiguously drawn. Do not allow sensitive data to go outside of the trust boundary and always be careful when interfacing with a compartment outside of the safe area. Ensure that appropriate compartmentalization is built into the system design, and the compartmentalization allows for and reinforces privilege separation functionality. Architects and designers should rely on the principle of least privilege to decide the appropriate time to use privileges and the time to drop privileges.",Carefully read both the name and description to ensure that this mapping is an appropriate fit. Do not try to 'force' a mapping to a lower-level Base/Variant simply to comply with this preferred level of abstraction.,N/A
280,Improper Handling of Insufficient Permissions or Privileges,ALLOWED,Base,The product does not handle or incorrectly handles when it has insufficient privileges to access resources or functionality as specified by their permissions. This may cause it to follow unexpected code paths that may leave the product in an invalid state.,"Other; Alter Execution Logic
Scope: Other","Strategy: Separation of Privilege Compartmentalize the system to have ""safe"" areas where trust boundaries can be unambiguously drawn. Do not allow sensitive data to go outside of the trust boundary and always be careful when interfacing with a compartment outside of the safe area. Ensure that appropriate compartmentalization is built into the system design, and the compartmentalization allows for and reinforces privilege separation functionality. Architects and designers should rely on the principle of least privilege to decide the appropriate time to use privileges and the time to drop privileges.

Always check to see if you have successfully accessed a resource or system functionality, and use proper error handling if it is unsuccessful. Do this even when you are operating in a highly privileged mode, because errors or environmental conditions might still cause a failure. For example, environments with highly granular permissions/privilege models, such as Windows or Linux capabilities, can cause unexpected failures.",Carefully read both the name and description to ensure that this mapping is an appropriate fit. Do not try to 'force' a mapping to a lower-level Base/Variant simply to comply with this preferred level of abstraction.,N/A
282,Improper Ownership Management,ALLOWED,Class,"The product assigns the wrong ownership, or does not properly verify the ownership, of an object or resource.","Gain Privileges or Assume Identity
Scope: Access Control","Very carefully manage the setting, management, and handling of privileges. Explicitly manage trust zones in the software.",Examine children of this entry to see if there is a better fit,N/A
284,Improper Access Control,DISCOURAGED,Pillar,"The product does not restrict or incorrectly restricts access to a resource from an unauthorized actor.

Access control involves the use of several protection mechanisms such as:

Authentication (proving the identity of an actor)
Authorization (ensuring that a given actor can access a resource), and
Accountability (tracking of activities that were performed)

When any mechanism is not applied or otherwise fails, attackers can compromise the security of the product by gaining privileges, reading sensitive information, executing commands, evading detection, etc.
There are two distinct behaviors that can introduce access control weaknesses:

Specification: incorrect privileges, permissions, ownership, etc. are explicitly specified for either the user or the resource (for example, setting a password file to be world-writable, or giving administrator capabilities to a guest user). This action could be performed by the program or the administrator.
Enforcement: the mechanism contains errors that prevent it from properly enforcing the specified access control requirements (e.g., allowing the user to specify their own privileges, or allowing a syntactically-incorrect ACL to produce insecure settings). This problem occurs within the program itself, in that it does not actually enforce the intended security policy that the administrator specifies.","Varies by Context
Scope: Other","Very carefully manage the setting, management, and handling of privileges. Explicitly manage trust zones in the software.

Strategy: Separation of Privilege Compartmentalize the system to have ""safe"" areas where trust boundaries can be unambiguously drawn. Do not allow sensitive data to go outside of the trust boundary and always be careful when interfacing with a compartment outside of the safe area. Ensure that appropriate compartmentalization is built into the system design, and the compartmentalization allows for and reinforces privilege separation functionality. Architects and designers should rely on the principle of least privilege to decide the appropriate time to use privileges and the time to drop privileges.","Consider using descendants of CWE-284 that are more specific to the kind of access control involved, such as those involving authorization (Missing Authorization ( CWE-862 ), Incorrect Authorization ( CWE-863 ), Incorrect Permission Assignment for Critical Resource ( CWE-732 ), etc.); authentication (Missing Authentication ( CWE-306 ) or Weak Authentication ( CWE-1390 )); Incorrect User Management ( CWE-286 ); Improper Restriction of Communication Channel to Intended Endpoints ( CWE-923 ); etc.","Authorization
                                    

The terms ""access control"" and ""authorization"" are often used interchangeably, although many people have distinct definitions. The CWE usage of ""access control"" is intended as a general term for the various mechanisms that restrict which users can access which resources, and ""authorization"" is more narrowly defined. It is unlikely that there will be community consensus on the use of these terms."
286,Incorrect User Management,ALLOWED,Class,"The product does not properly manage a user within its environment.

Users can be assigned to the wrong group (class) of permissions resulting in unintended access rights to sensitive objects.","Varies by Context
Scope: Other",N/A,Examine children of this entry to see if there is a better fit,N/A
300,Channel Accessible by Non-Endpoint,DISCOURAGED,Class,"The product does not adequately verify the identity of actors at both ends of a communication channel, or does not adequately ensure the integrity of the channel, in a way that allows the channel to be accessed or influenced by an actor that is not an endpoint.

In order to establish secure communication between two parties, it is often important to adequately verify the identity of entities at each end of the communication channel. Inadequate or inconsistent verification may result in insufficient or incorrect identification of either communicating entity. This can have negative consequences such as misplaced trust in the entity at the other end of the channel. An attacker can leverage this by interposing between the communicating entities and masquerading as the original entity. In the absence of sufficient verification of identity, such an attacker can eavesdrop and potentially modify the communication between the original entities.","Read Application Data; Modify Application Data; Gain Privileges or Assume Identity
Scope: Confidentiality, Integrity, Access Control An attacker could pose as one of the entities and read or possibly modify the communication.","Always fully authenticate both ends of any communications channel.

Adhere to the principle of complete mediation.

A certificate binds an identity to a cryptographic key to authenticate a communicating party. Often, the certificate takes the encrypted form of the hash of the identity of the subject, the public key, and information such as time of issue or expiration using the issuer's private key. The certificate can be validated by deciphering the certificate with the issuer's public key. See also X.509 certificate signature chains and the PGP certification structure.","Consider root-cause weaknesses that allow adversary-in-the-middle attacks to happen, such as CWEs involving poor integrity protection.","Adversary-in-the-Middle / AITM
                                    





                                        Attacker-in-the-Middle / AITM
                                    





                                        Man-in-the-Middle / MITM
                                    





                                        Person-in-the-Middle / PITM
                                    





                                        Monkey-in-the-Middle
                                    





                                        Monster-in-the-Middle
                                    





                                        Manipulator-in-the-Middle
                                    





                                        On-path attack
                                    





                                        Interception attack"
301,Reflection Attack in an Authentication Protocol,ALLOWED,Base,"Simple authentication protocols are subject to reflection attacks if a malicious user can use the target machine to impersonate a trusted user.

A mutual authentication protocol requires each party to respond to a random challenge by the other party by encrypting it with a pre-shared key. Often, however, such protocols employ the same pre-shared key for communication with a number of different entities. A malicious user or an attacker can easily compromise this protocol without possessing the correct key by employing a reflection attack on the protocol.
Reflection attacks capitalize on mutual authentication schemes in order to trick the target into revealing the secret shared between it and another valid user. In a basic mutual-authentication scheme, a secret is known to both the valid user and the server; this allows them to authenticate. In order that they may verify this shared secret without sending it plainly over the wire, they utilize a Diffie-Hellman-style scheme in which they each pick a value, then request the hash of that value as keyed by the shared secret. In a reflection attack, the attacker claims to be a valid user and requests the hash of a random value from the server. When the server returns this value and requests its own value to be hashed, the attacker opens another connection to the server. This time, the hash requested by the attacker is the value which the server requested in the first connection. When the server returns this hashed value, it is used in the first connection, authenticating the attacker successfully as the impersonated valid user.","Gain Privileges or Assume Identity
Scope: Access Control The primary result of reflection attacks is successful authentication with a target machine -- as an impersonated user.","Use different keys for the initiator and responder or of a different type of challenge for the initiator and responder.

Let the initiator prove its identity before proceeding.",Carefully read both the name and description to ensure that this mapping is an appropriate fit. Do not try to 'force' a mapping to a lower-level Base/Variant simply to comply with this preferred level of abstraction.,N/A
