ID,Title,Vulnerability_Mapping,Abstraction,Description,Impact,Mitigation,Comments,Alternate_Terms
20,Improper Input Validation,DISCOURAGED,Class,"The product receives input or data, but it does
        not validate or incorrectly validates that the input has the
        properties that are required to process the data safely and
        correctly.

Input validation is a frequently-used technique
	   for checking potentially dangerous inputs in order to
	   ensure that the inputs are safe for processing within the
	   code, or when communicating with other components.
Input can consist of:

raw data - strings, numbers, parameters, file contents, etc.
metadata - information about the raw data, such as headers or size

Data can be simple or structured.  Structured data
	   can be composed of many nested layers, composed of
	   combinations of metadata and raw data, with other simple or
	   structured data.
Many properties of raw data or metadata may need
	   to be validated upon entry into the code, such
	   as:

specified quantities such as size, length, frequency, price, rate, number of operations, time, etc.
implied or derived quantities, such as the actual size of a file instead of a specified size
indexes, offsets, or positions into more complex data structures
symbolic keys or other elements into hash tables, associative arrays, etc.
well-formedness, i.e. syntactic correctness - compliance with expected syntax 
lexical token correctness - compliance with rules for what is treated as a token
specified or derived type - the actual type of the input (or what the input appears to be)
consistency - between individual data elements, between raw data and metadata, between references, etc.
conformance to domain-specific rules, e.g. business logic 
equivalence - ensuring that equivalent inputs are treated the same
authenticity, ownership, or other attestations about the input, e.g. a cryptographic signature to prove the source of the data

Implied or derived properties of data must often
	   be calculated or inferred by the code itself.  Errors in
	   deriving properties may be considered a contributing factor
	   to improper input validation.","DoS: Crash, Exit, or Restart; DoS: Resource Consumption (CPU); DoS: Resource Consumption (Memory)
Scope: Availability An attacker could provide unexpected values and cause a program crash or arbitrary control of resource allocation, leading to excessive consumption of resources such as memory and CPU.

Read Memory; Read Files or Directories
Scope: Confidentiality An attacker could read confidential data if they are able to control resource references.

Modify Memory; Execute Unauthorized Code or Commands
Scope: Integrity, Confidentiality, Availability An attacker could use malicious input to modify data or possibly alter control flow in unexpected ways, including arbitrary command execution.","Strategy: Attack Surface Reduction Consider using language-theoretic security (LangSec) techniques that characterize inputs using a formal language and build ""recognizers"" for that language.  This effectively requires parsing to be a distinct layer that effectively enforces a boundary between raw input and internal data representations, instead of allowing parser code to be scattered throughout the program, where it could be subject to errors or inconsistencies that create weaknesses. [ REF-1109 ] [ REF-1110 ] [ REF-1111 ]

Strategy: Libraries or Frameworks Use an input validation framework such as Struts or the OWASP ESAPI Validation API. Note that using a framework does not automatically address all input validation problems; be mindful of weaknesses that could arise from misusing the framework itself ( CWE-1173 ).

Strategy: Attack Surface Reduction Understand all the potential areas where untrusted inputs can enter the product, including but not limited to: parameters or arguments, cookies, anything read from the network, environment variables, reverse DNS lookups, query results, request headers, URL components, e-mail, files, filenames, databases, and any external systems that provide data to the application. Remember that such inputs may be obtained indirectly through API calls.

Strategy: Input Validation Assume all input is malicious. Use an ""accept known good"" input validation strategy, i.e., use a list of acceptable inputs that strictly conform to specifications. Reject any input that does not strictly conform to specifications, or transform it into something that does. When performing input validation, consider all potentially relevant properties, including length, type of input, the full range of acceptable values, missing or extra inputs, syntax, consistency across related fields, and conformance to business rules. As an example of business rule logic, ""boat"" may be syntactically valid because it only contains alphanumeric characters, but it is not valid if the input is only expected to contain colors such as ""red"" or ""blue."" Do not rely exclusively on looking for malicious or malformed inputs.  This is likely to miss at least one undesirable input, especially if the code's environment changes. This can give attackers enough room to bypass the intended validation. However, denylists can be useful for detecting potential attacks or determining which inputs are so malformed that they should be rejected outright. Effectiveness: High

For any security checks that are performed on the client side, ensure that these checks are duplicated on the server side, in order to avoid CWE-602 . Attackers can bypass the client-side checks by modifying values after the checks have been performed, or by changing the client to remove the client-side checks entirely. Then, these modified values would be submitted to the server. Even though client-side checks provide minimal benefits with respect to server-side security, they are still useful. First, they can support intrusion detection. If the server receives input that should have been rejected by the client, then it may be an indication of an attack. Second, client-side error-checking can provide helpful feedback to the user about the expectations for valid input. Third, there may be a reduction in server-side processing time for accidental input errors, although this is typically a small savings.

When your application combines data from multiple sources, perform the validation after the sources have been combined. The individual data elements may pass the validation step but violate the intended restrictions after they have been combined.

Be especially careful to validate all input when invoking code that crosses language boundaries, such as from an interpreted language to native code. This could create an unexpected interaction between the language boundaries. Ensure that you are not violating any of the expectations of the language with which you are interfacing. For example, even though Java may not be susceptible to buffer overflows, providing a large argument in a call to native code might trigger an overflow.

Directly convert your input type into the expected data type, such as using a conversion function that translates a string into a number. After converting to the expected data type, ensure that the input's values fall within the expected range of allowable values and that multi-field consistencies are maintained.

Inputs should be decoded and canonicalized to the application's current internal representation before being validated ( CWE-180 , CWE-181 ). Make sure that your application does not inadvertently decode the same input twice ( CWE-174 ). Such errors could be used to bypass allowlist schemes by introducing dangerous inputs after they have been checked. Use libraries such as the OWASP ESAPI Canonicalization control. Consider performing repeated canonicalization until your input does not change any more. This will avoid double-decoding and similar scenarios, but it might inadvertently modify inputs that are allowed to contain properly-encoded dangerous content.

When exchanging data between components, ensure that both components are using the same character encoding. Ensure that the proper encoding is applied at each interface. Explicitly set the encoding you are using whenever the protocol allows you to do so.","Within CWE, the ""input validation"" term focuses on the act of checking whether an input is already safe, which is different from other techniques that ensure safe processing of input.  Carefully perform root-cause analysis to be sure that the issue is not due to techniques that attempt to transform potentially-dangerous input into something safe, such as filtering ( CWE-790 ) - which attempts to remove dangerous inputs - or encoding/escaping ( CWE-116 ), which attempts to ensure that the input is not misinterpreted when it is included in output to another component. If the issue is truly due to imroper input validation, consider using lower-level children such as Improper Use of Validation Framework ( CWE-1173 ) or improper validation involving specific types or properties of input such as Specified Quantity ( CWE-1284 ); Specified Index, Position, or Offset ( CWE-1285 ); Syntactic Correctness ( CWE-1286 ); Specified Type ( CWE-1287 ); Consistency within Input ( CWE-1288 ); or Unsafe Equivalence ( CWE-1289 ).",N/A
32,Path Traversal: '...' (Triple Dot),ALLOWED,Variant,"The product uses external input to construct a pathname that should be within a restricted directory, but it does not properly neutralize '...' (triple dot) sequences that can resolve to a location that is outside of that directory.

This allows attackers to traverse the file system to access files or directories that are outside of the restricted directory.
The '...' manipulation is useful for bypassing some path traversal protection schemes. On some Windows systems, it is equivalent to ""..\.."" and might bypass checks that assume only two dots are valid. Incomplete filtering, such as removal of ""./"" sequences, can ultimately produce valid "".."" sequences due to a collapse into unsafe value (CWE-182).","Read Files or Directories; Modify Files or Directories
Scope: Confidentiality, Integrity","Strategy: Input Validation Assume all input is malicious. Use an ""accept known good"" input validation strategy, i.e., use a list of acceptable inputs that strictly conform to specifications. Reject any input that does not strictly conform to specifications, or transform it into something that does. When performing input validation, consider all potentially relevant properties, including length, type of input, the full range of acceptable values, missing or extra inputs, syntax, consistency across related fields, and conformance to business rules. As an example of business rule logic, ""boat"" may be syntactically valid because it only contains alphanumeric characters, but it is not valid if the input is only expected to contain colors such as ""red"" or ""blue."" Do not rely exclusively on looking for malicious or malformed inputs.  This is likely to miss at least one undesirable input, especially if the code's environment changes. This can give attackers enough room to bypass the intended validation. However, denylists can be useful for detecting potential attacks or determining which inputs are so malformed that they should be rejected outright. When validating filenames, use stringent allowlists that limit the character set to be used. If feasible, only allow a single ""."" character in the filename to avoid weaknesses such as CWE-23 , and exclude directory separators such as ""/"" to avoid CWE-36 . Use a list of allowable file extensions, which will help to avoid CWE-434 . Do not rely exclusively on a filtering mechanism that removes potentially dangerous characters. This is equivalent to a denylist, which may be incomplete ( CWE-184 ). For example, filtering ""/"" is insufficient protection if the filesystem also supports the use of ""\"" as a directory separator. Another possible error could occur when the filtering is applied in a way that still produces dangerous data ( CWE-182 ). For example, if ""../"" sequences are removed from the "".../...//"" string in a sequential fashion, two instances of ""../"" would be removed from the original string, but the remaining characters would still form the ""../"" string. Effectiveness: High

Strategy: Input Validation Inputs should be decoded and canonicalized to the application's current internal representation before being validated ( CWE-180 ). Make sure that the application does not decode the same input twice ( CWE-174 ). Such errors could be used to bypass allowlist validation schemes by introducing dangerous inputs after they have been checked.",Carefully read both the name and description to ensure that this mapping is an appropriate fit. Do not try to 'force' a mapping to a lower-level Base/Variant simply to comply with this preferred level of abstraction.,N/A
33,Path Traversal: '....' (Multiple Dot),ALLOWED,Variant,"The product uses external input to construct a pathname that should be within a restricted directory, but it does not properly neutralize '....' (multiple dot) sequences that can resolve to a location that is outside of that directory.

This allows attackers to traverse the file system to access files or directories that are outside of the restricted directory.
The '....' manipulation is useful for bypassing some path traversal protection schemes. On some Windows systems, it is equivalent to ""..\..\.."" and might bypass checks that assume only two dots are valid. Incomplete filtering, such as removal of ""./"" sequences, can ultimately produce valid "".."" sequences due to a collapse into unsafe value (CWE-182).","Read Files or Directories; Modify Files or Directories
Scope: Confidentiality, Integrity","Strategy: Input Validation Assume all input is malicious. Use an ""accept known good"" input validation strategy, i.e., use a list of acceptable inputs that strictly conform to specifications. Reject any input that does not strictly conform to specifications, or transform it into something that does. When performing input validation, consider all potentially relevant properties, including length, type of input, the full range of acceptable values, missing or extra inputs, syntax, consistency across related fields, and conformance to business rules. As an example of business rule logic, ""boat"" may be syntactically valid because it only contains alphanumeric characters, but it is not valid if the input is only expected to contain colors such as ""red"" or ""blue."" Do not rely exclusively on looking for malicious or malformed inputs.  This is likely to miss at least one undesirable input, especially if the code's environment changes. This can give attackers enough room to bypass the intended validation. However, denylists can be useful for detecting potential attacks or determining which inputs are so malformed that they should be rejected outright. When validating filenames, use stringent allowlists that limit the character set to be used. If feasible, only allow a single ""."" character in the filename to avoid weaknesses such as CWE-23 , and exclude directory separators such as ""/"" to avoid CWE-36 . Use a list of allowable file extensions, which will help to avoid CWE-434 . Do not rely exclusively on a filtering mechanism that removes potentially dangerous characters. This is equivalent to a denylist, which may be incomplete ( CWE-184 ). For example, filtering ""/"" is insufficient protection if the filesystem also supports the use of ""\"" as a directory separator. Another possible error could occur when the filtering is applied in a way that still produces dangerous data ( CWE-182 ). For example, if ""../"" sequences are removed from the "".../...//"" string in a sequential fashion, two instances of ""../"" would be removed from the original string, but the remaining characters would still form the ""../"" string. Effectiveness: High

Strategy: Input Validation Inputs should be decoded and canonicalized to the application's current internal representation before being validated ( CWE-180 ). Make sure that the application does not decode the same input twice ( CWE-174 ). Such errors could be used to bypass allowlist validation schemes by introducing dangerous inputs after they have been checked.",Carefully read both the name and description to ensure that this mapping is an appropriate fit. Do not try to 'force' a mapping to a lower-level Base/Variant simply to comply with this preferred level of abstraction.,N/A
73,External Control of File Name or Path,ALLOWED,Base,"The product allows user input to control or influence paths or file names that are used in filesystem operations.

This could allow an attacker to access or modify system files or other files that are critical to the application.
Path manipulation errors occur when the following two conditions are met:

1. An attacker can specify a path used in an operation on the filesystem.
2. By specifying the resource, the attacker gains a capability that would not otherwise be permitted.

For example, the program may give the attacker the ability to overwrite the specified file or run with a configuration controlled by the attacker.","Read Files or Directories; Modify Files or Directories
Scope: Integrity, Confidentiality The application can operate on unexpected files. Confidentiality is violated when the targeted filename is not directly readable by the attacker.

Modify Files or Directories; Execute Unauthorized Code or Commands
Scope: Integrity, Confidentiality, Availability The application can operate on unexpected files. This may violate integrity if the filename is written to, or if the filename is for a program or other form of executable code.

DoS: Crash, Exit, or Restart; DoS: Resource Consumption (Other)
Scope: Availability The application can operate on unexpected files. Availability can be violated if the attacker specifies an unexpected file that the application modifies. Availability can also be affected if the attacker specifies a filename for a large file, or points to a special device or a file that does not have the format that the application expects.","When the set of filenames is limited or known, create a mapping from a set of fixed input values (such as numeric IDs) to the actual filenames, and reject all other inputs. For example, ID 1 could map to ""inbox.txt"" and ID 2 could map to ""profile.txt"". Features such as the ESAPI AccessReferenceMap provide this capability.

Run your code in a ""jail"" or similar sandbox environment that enforces strict boundaries between the process and the operating system. This may effectively restrict all access to files within a particular directory. Examples include the Unix chroot jail and AppArmor. In general, managed code may provide some protection. This may not be a feasible solution, and it only limits the impact to the operating system; the rest of your application may still be subject to compromise. Be careful to avoid CWE-243 and other weaknesses related to jails.

For any security checks that are performed on the client side, ensure that these checks are duplicated on the server side, in order to avoid CWE-602 . Attackers can bypass the client-side checks by modifying values after the checks have been performed, or by changing the client to remove the client-side checks entirely. Then, these modified values would be submitted to the server.

Strategy: Input Validation Assume all input is malicious. Use an ""accept known good"" input validation strategy, i.e., use a list of acceptable inputs that strictly conform to specifications. Reject any input that does not strictly conform to specifications, or transform it into something that does. When performing input validation, consider all potentially relevant properties, including length, type of input, the full range of acceptable values, missing or extra inputs, syntax, consistency across related fields, and conformance to business rules. As an example of business rule logic, ""boat"" may be syntactically valid because it only contains alphanumeric characters, but it is not valid if the input is only expected to contain colors such as ""red"" or ""blue."" Do not rely exclusively on looking for malicious or malformed inputs.  This is likely to miss at least one undesirable input, especially if the code's environment changes. This can give attackers enough room to bypass the intended validation. However, denylists can be useful for detecting potential attacks or determining which inputs are so malformed that they should be rejected outright. When validating filenames, use stringent allowlists that limit the character set to be used. If feasible, only allow a single ""."" character in the filename to avoid weaknesses such as CWE-23 , and exclude directory separators such as ""/"" to avoid CWE-36 . Use a list of allowable file extensions, which will help to avoid CWE-434 . Do not rely exclusively on a filtering mechanism that removes potentially dangerous characters. This is equivalent to a denylist, which may be incomplete ( CWE-184 ). For example, filtering ""/"" is insufficient protection if the filesystem also supports the use of ""\"" as a directory separator. Another possible error could occur when the filtering is applied in a way that still produces dangerous data ( CWE-182 ). For example, if ""../"" sequences are removed from the "".../...//"" string in a sequential fashion, two instances of ""../"" would be removed from the original string, but the remaining characters would still form the ""../"" string. Effectiveness: High

Use a built-in path canonicalization function (such as realpath() in C) that produces the canonical version of the pathname, which effectively removes "".."" sequences and symbolic links ( CWE-23 , CWE-59 ).

Use OS-level permissions and run as a low-privileged user to limit the scope of any successful attack.

If you are using PHP, configure your application so that it does not use register_globals. During implementation, develop your application so that it does not rely on this feature, but be wary of implementing a register_globals emulation that is subject to weaknesses such as CWE-95 , CWE-621 , and similar issues.

Use tools and techniques that require manual (human) analysis, such as penetration testing, threat modeling, and interactive tools that allow the tester to record and modify an active session. These may be more effective than strictly automated techniques. This is especially the case with weaknesses that are related to design and business rules.",Carefully read both the name and description to ensure that this mapping is an appropriate fit. Do not try to 'force' a mapping to a lower-level Base/Variant simply to comply with this preferred level of abstraction.,N/A
74,Improper Neutralization of Special Elements in Output Used by a Downstream Component ('Injection'),DISCOURAGED,Class,"The product constructs all or part of a command, data structure, or record using externally-influenced input from an upstream component, but it does not neutralize or incorrectly neutralizes special elements that could modify how it is parsed or interpreted when it is sent to a downstream component.","Read Application Data
Scope: Confidentiality Many injection attacks involve the disclosure of important information -- in terms of both data sensitivity and usefulness in further exploitation.

Bypass Protection Mechanism
Scope: Access Control In some cases, injectable code controls authentication; this may lead to a remote vulnerability.

Alter Execution Logic
Scope: Other Injection attacks are characterized by the ability to significantly change the flow of a given process, and in some cases, to the execution of arbitrary code.

Other
Scope: Integrity, Other Data injection attacks lead to loss of data integrity in nearly all cases as the control-plane data injected is always incidental to data recall or writing.

Hide Activities
Scope: Non-Repudiation Often the actions performed by injected control code are unlogged.","Programming languages and supporting technologies might be chosen which are not subject to these issues.

Utilize an appropriate mix of allowlist and denylist parsing to filter control-plane syntax from all input.",Examine the children and descendants of this entry to find a more precise mapping.,N/A
