ID,Title,Vulnerability_Mapping,Abstraction,Description,Impact,Mitigation,Comments,Alternate_Terms
446,UI Discrepancy for Security Feature,ALLOWED,Class,"The user interface does not correctly enable or configure a security feature, but the interface provides feedback that causes the user to believe that the feature is in a secure state.

When the user interface does not properly reflect what the user asks of it, then it can lead the user into a false sense of security. For example, the user might check a box to enable a security option to enable encrypted communications, but the product does not actually enable the encryption. Alternately, the user might provide a ""restrict ALL"" access control rule, but the product only implements ""restrict SOME"".","Varies by Context
Scope: Other",N/A,Examine children of this entry to see if there is a better fit,N/A
451,User Interface (UI) Misrepresentation of Critical Information,ALLOWED,Class,"The user interface (UI) does not properly represent critical information to the user, allowing the information - or its source - to be obscured or spoofed. This is often a component in phishing attacks.

If an attacker can cause the UI to display erroneous data, or to otherwise convince the user to display information that appears to come from a trusted source, then the attacker could trick the user into performing the wrong action. This is often a component in phishing attacks, but other kinds of problems exist. For example, if the UI is used to monitor the security state of a system or network, then omitting or obscuring an important indicator could prevent the user from detecting and reacting to a security-critical event.
UI misrepresentation can take many forms:

Incorrect indicator: incorrect information is displayed, which prevents the user from understanding the true state of the product or the environment the product is monitoring, especially of potentially-dangerous conditions or operations. This can be broken down into several different subtypes.
Overlay: an area of the display is intended to give critical information, but another process can modify the display by overlaying another element on top of it. The user is not interacting with the expected portion of the user interface. This is the problem that enables clickjacking attacks, although many other types of attacks exist that involve overlay.
Icon manipulation: the wrong icon, or the wrong color indicator, can be influenced (such as making a dangerous .EXE executable look like a harmless .GIF)
Timing: the product is performing a state transition or context switch that is presented to the user with an indicator, but a race condition can cause the wrong indicator to be used before the product has fully switched context. The race window could be extended indefinitely if the attacker can trigger an error.
Visual truncation: important information could be truncated from the display, such as a long filename with a dangerous extension that is not displayed in the GUI because the malicious portion is truncated. The use of excessive whitespace can also cause truncation, or place the potentially-dangerous indicator outside of the user's field of view (e.g. ""filename.txt .exe""). A different type of truncation can occur when a portion of the information is removed due to reasons other than length, such as the accidental insertion of an end-of-input marker in the middle of an input, such as a NUL byte in a C-style string.
Visual distinction: visual information might be presented in a way that makes it difficult for the user to quickly and correctly distinguish between critical and unimportant segments of the display.
Homographs: letters from different character sets, fonts, or languages can appear very similar (i.e. may be visually equivalent) in a way that causes the human user to misread the text (for example, to conduct phishing attacks to trick a user into visiting a malicious web site with a visually-similar name as a trusted site). This can be regarded as a type of visual distinction issue.","Hide Activities; Bypass Protection Mechanism
Scope: Non-Repudiation, Access Control","Strategy: Input Validation Perform data validation (e.g. syntax, length, etc.) before interpreting the data.

Strategy: Output Encoding Create a strategy for presenting information, and plan for how to display unusual characters.",Examine children of this entry to see if there is a better fit,N/A
453,Insecure Default Variable Initialization,ALLOWED,Variant,"The product, by default, initializes an internal variable with an insecure or less secure value than is possible.","Modify Application Data
Scope: Integrity An attacker could gain access to and modify sensitive data or system information.","Disable or change default settings when they can be used to abuse the system. Since those default settings are shipped with the product they are likely to be known by a potential attacker who is familiar with the product. For instance, default credentials should be changed or the associated accounts should be disabled.",Carefully read both the name and description to ensure that this mapping is an appropriate fit. Do not try to 'force' a mapping to a lower-level Base/Variant simply to comply with this preferred level of abstraction.,N/A
466,Return of Pointer Value Outside of Expected Range,ALLOWED,Base,A function can return a pointer to memory that is outside of the buffer that the pointer is expected to reference.,"Read Memory; Modify Memory
Scope: Confidentiality, Integrity",N/A,Carefully read both the name and description to ensure that this mapping is an appropriate fit. Do not try to 'force' a mapping to a lower-level Base/Variant simply to comply with this preferred level of abstraction.,N/A
502,Deserialization of Untrusted Data,ALLOWED,Base,The product deserializes untrusted data without sufficiently ensuring that the resulting data will be valid.,"Modify Application Data; Unexpected State
Scope: Integrity Attackers can modify unexpected objects or data that was assumed to be safe from modification. Deserialized data or code could be modified without using the provided accessor functions, or unexpected functions could be invoked.

DoS: Resource Consumption (CPU)
Scope: Availability If a function is making an assumption on when to terminate, based on a sentry in a string, it could easily never terminate.

Varies by Context
Scope: Other The consequences can vary widely, because it depends on which objects or methods are being deserialized, and how they are used. Making an assumption that the code in the deserialized object is valid is dangerous and can enable exploitation. One example is attackers using gadget chains to perform unauthorized actions, such as generating a shell.","If available, use the signing/sealing features of the programming language to assure that deserialized data has not been tainted. For example, a hash-based message authentication code (HMAC) could be used to ensure that data has not been modified.

When deserializing data, populate a new object rather than just deserializing. The result is that the data flows through safe input validation and that the functions are safe.

Explicitly define a final object() to prevent deserialization.

Make fields transient to protect them from deserialization. An attempt to serialize and then deserialize a class containing transient fields will result in NULLs where the transient data should be. This is an excellent way to prevent time, environment-based, or sensitive variables from being carried over and used improperly.

Avoid having unnecessary types or gadgets (a sequence of instances and method invocations that can self-execute during the deserialization process, often found in libraries) available that can be leveraged for malicious ends. This limits the potential for unintended or unauthorized types and gadgets to be leveraged by the attacker. Add only acceptable classes to an allowlist. Note: new gadgets are constantly being discovered, so this alone is not a sufficient mitigation.

Employ cryptography of the data or code for protection. However, it's important to note that it would still be client-side security. This is risky because if the client is compromised then the security implemented on the client (the cryptography) can be bypassed.

Strategy: Firewall Use an application firewall that can detect attacks against this weakness. It can be beneficial in cases in which the code cannot be fixed (because it is controlled by a third party), as an emergency prevention measure while more comprehensive software assurance measures are applied, or to provide defense in depth [ REF-1481 ]. Effectiveness: Moderate Note: An application firewall might not cover all possible input vectors. In addition, attack techniques might be available to bypass the protection mechanism, such as using malformed inputs that can still be processed by the component that receives those inputs. Depending on functionality, an application firewall might inadvertently reject or modify legitimate requests. Finally, some manual effort may be required for customization.",Carefully read both the name and description to ensure that this mapping is an appropriate fit. Do not try to 'force' a mapping to a lower-level Base/Variant simply to comply with this preferred level of abstraction.,"Marshaling, Unmarshaling
                                    

Marshaling and unmarshaling are effectively synonyms for serialization and deserialization, respectively.




                                        Pickling, Unpickling
                                    

In Python, the ""pickle"" functionality is used to perform serialization and deserialization.




                                        PHP Object Injection
                                    

Some PHP application researchers use this term when attacking unsafe use of the unserialize() function; but it is also used for CWE-915."
514,Covert Channel,ALLOWED,Class,"A covert channel is a path that can be used to transfer information in a way not intended by the system's designers.

Typically the system has not given authorization for the transmission and has no knowledge of its occurrence.","Read Application Data; Bypass Protection Mechanism
Scope: Confidentiality, Access Control",N/A,Examine children of this entry to see if there is a better fit,N/A
515,Covert Storage Channel,ALLOWED,Base,"A covert storage channel transfers information through the setting of bits by one program and the reading of those bits by another. What distinguishes this case from that of ordinary operation is that the bits are used to convey encoded information.

Covert storage channels occur when out-of-band data is stored in messages for the purpose of memory reuse. Covert channels are frequently classified as either storage or timing channels. Examples would include using a file intended to hold only audit information to convey user passwords--using the name of a file or perhaps status bits associated with it that can be read by all users to signal the contents of the file. Steganography, concealing information in such a manner that no one but the intended recipient knows of the existence of the message, is a good example of a covert storage channel.","Read Application Data
Scope: Confidentiality Covert storage channels may provide attackers with important information about the system in question.

Read Application Data
Scope: Integrity, Confidentiality If these messages or packets are sent with unnecessary data contained within, it may tip off malicious listeners as to the process that created the message. With this information, attackers may learn any number of things, including the hardware platform, operating system, or algorithms used by the sender. This information can be of significant value to the user in launching further attacks.",Ensure that all reserved fields are set to zero before messages are sent and that no unnecessary information is included.,Carefully read both the name and description to ensure that this mapping is an appropriate fit. Do not try to 'force' a mapping to a lower-level Base/Variant simply to comply with this preferred level of abstraction.,N/A
538,Insertion of Sensitive Information into Externally-Accessible File or Directory,ALLOWED,Base,"The product places sensitive information into files or directories that are accessible to actors who are allowed to have access to the files, but not to the sensitive information.","Read Files or Directories
Scope: Confidentiality",Do not expose file and directory information to the user.,Carefully read both the name and description to ensure that this mapping is an appropriate fit. Do not try to 'force' a mapping to a lower-level Base/Variant simply to comply with this preferred level of abstraction.,N/A
600,Uncaught Exception in Servlet,ALLOWED,Variant,"The Servlet does not catch all exceptions, which may reveal sensitive debugging information.

When a Servlet throws an exception, the default error response the Servlet container sends back to the user typically includes debugging information. This information is of great value to an attacker. For example, a stack trace might show the attacker a malformed SQL query string, the type of database being used, and the version of the application container. This information enables the attacker to target known vulnerabilities in these components.","Read Application Data; DoS: Crash, Exit, or Restart
Scope: Confidentiality, Availability",Implement Exception blocks to handle all types of Exceptions.,Carefully read both the name and description to ensure that this mapping is an appropriate fit. Do not try to 'force' a mapping to a lower-level Base/Variant simply to comply with this preferred level of abstraction.,Missing Catch Block
610,Externally Controlled Reference to a Resource in Another Sphere,DISCOURAGED,Class,The product uses an externally controlled name or reference that resolves to a resource that is outside of the intended control sphere.,"Read Application Data; Modify Application Data
Scope: Confidentiality, Integrity An adversary could read or modify data, depending on how the resource is intended to be used.

Gain Privileges or Assume Identity
Scope: Access Control Likelihood: High An adversary that can supply a reference to an unintended resource can potentially access a resource that they do not have privileges for, thus bypassing existing access control mechanisms.",N/A,Examine children of this entry to see if there is a better fit,N/A
640,Weak Password Recovery Mechanism for Forgotten Password,ALLOWED,Base,"The product contains a mechanism for users to recover or change their passwords without knowing the original password, but the mechanism is weak.

It is common for an application to have a mechanism that provides a means for a user to gain access to their account in the event they forget their password. Very often the password recovery mechanism is weak, which has the effect of making it more likely that it would be possible for a person other than the legitimate system user to gain access to that user's account. Weak password recovery schemes completely undermine a strong password authentication scheme.
This weakness may be that the security question is too easy to guess or find an answer to (e.g. because the question is too common, or the answers can be found using social media). Or there might be an implementation weakness in the password recovery mechanism code that may for instance trick the system into e-mailing the new password to an e-mail account other than that of the user. There might be no throttling done on the rate of password resets so that a legitimate user can be denied service by an attacker if an attacker tries to recover their password in a rapid succession. The system may send the original password to the user rather than generating a new temporary password. In summary, password recovery functionality, if not carefully designed and implemented can often become the system's weakest link that can be misused in a way that would allow an attacker to gain unauthorized access to the system.","Gain Privileges or Assume Identity
Scope: Access Control An attacker could gain unauthorized access to the system by retrieving legitimate user's authentication credentials.

DoS: Resource Consumption (Other)
Scope: Availability An attacker could deny service to legitimate system users by launching a brute force attack on the password recovery mechanism using user ids of legitimate users.

Other
Scope: Integrity, Other The system's security functionality is turned against the system by the attacker.","Make sure that all input supplied by the user to the password recovery mechanism is thoroughly filtered and validated.

Do not use standard weak security questions and use several security questions.

Make sure that there is throttling on the number of incorrect answers to a security question. Disable the password recovery functionality after a certain (small) number of incorrect guesses.

Require that the user properly answers the security question prior to resetting their password and sending the new password to the e-mail address of record.

Never allow the user to control what e-mail address the new password will be sent to in the password recovery mechanism.

Assign a new temporary password rather than revealing the original password.","CWE-640 should only be used when there is a ""password recovery"" mechanism for forgotten passwords. Consider password-related entries under CWE-1390 : Weak Authentication.",N/A
654,Reliance on a Single Factor in a Security Decision,ALLOWED,Base,"A protection mechanism relies exclusively, or to a large extent, on the evaluation of a single condition or the integrity of a single object or entity in order to make a decision about granting access to restricted resources or functionality.","Gain Privileges or Assume Identity
Scope: Access Control If the single factor is compromised (e.g. by theft or spoofing), then the integrity of the entire security mechanism can be violated with respect to the user that is identified by that factor.

Hide Activities
Scope: Non-Repudiation It can become difficult or impossible for the product to be able to distinguish between legitimate activities by the entity who provided the factor, versus illegitimate activities by an attacker.","Use multiple simultaneous checks before granting access to critical operations or granting critical privileges. A weaker but helpful mitigation is to use several successive checks (multiple layers of security).

Use redundant access rules on different choke points (e.g., firewalls).",Carefully read both the name and description to ensure that this mapping is an appropriate fit. Do not try to 'force' a mapping to a lower-level Base/Variant simply to comply with this preferred level of abstraction.,"Separation of Privilege
                                    

Some people and publications use the term ""Separation of Privilege"" to describe this weakness, but this term has dual meanings in current usage. While this entry is closely associated with the original definition of ""Separation of Privilege"" by Saltzer and Schroeder, others use the same term to describe poor compartmentalization (CWE-653). Because there are multiple interpretations, use of the ""Separation of Privilege"" term is discouraged."
662,Improper Synchronization,DISCOURAGED,Class,"The product utilizes multiple threads, processes, components, or systems to allow temporary access to a shared resource that can only be exclusive to one process at a time, but it does not properly synchronize these actions, which might cause simultaneous accesses of this resource by multiple threads or processes.

Synchronization refers to a variety of behaviors and mechanisms that allow two or more independently-operating processes or threads to ensure that they operate on shared resources in predictable ways that do not interfere with each other.  Some shared resource operations cannot be executed atomically; that is, multiple steps must be guaranteed to execute sequentially, without any interference by other processes.  Synchronization mechanisms vary widely, but they may include locking, mutexes, and semaphores.  When a multi-step operation on a shared resource cannot be guaranteed to execute independent of interference, then the resulting behavior can be unpredictable. Improper synchronization could lead to data or memory corruption, denial of service, etc.","Modify Application Data; Read Application Data; Alter Execution Logic
Scope: Integrity, Confidentiality, Other",Use industry standard APIs to synchronize your code.,Examine children of this entry to see if there is a better fit,N/A
664,Improper Control of a Resource Through its Lifetime,DISCOURAGED,Pillar,"The product does not maintain or incorrectly maintains control over a resource throughout its lifetime of creation, use, and release.

Resources often have explicit instructions on how to be created, used and destroyed. When code does not follow these instructions, it can lead to unexpected behaviors and potentially exploitable states.
Even without explicit instructions, various principles are expected to be adhered to, such as ""Do not use an object until after its creation is complete,"" or ""do not use an object after it has been slated for destruction.""","Other
Scope: Other",N/A,Consider children or descendants of this entry instead.,N/A
667,Improper Locking,ALLOWED,Class,"The product does not properly acquire or release a lock on a resource, leading to unexpected resource state changes and behaviors.

Locking is a type of synchronization behavior that ensures that multiple independently-operating processes or threads do not interfere with each other when accessing the same resource. All processes/threads are expected to follow the same steps for locking. If these steps are not followed precisely - or if no locking is done at all - then another process/thread could modify the shared resource in a way that is not visible or predictable to the original process.  This can lead to data or memory corruption, denial of service, etc.","DoS: Resource Consumption (CPU)
Scope: Availability Inconsistent locking discipline can lead to deadlock.",Strategy: Libraries or Frameworks Use industry standard APIs to implement locking mechanism.,Examine children of this entry to see if there is a better fit,N/A
670,Always-Incorrect Control Flow Implementation,ALLOWED,Class,"The code contains a control flow path that does not reflect the algorithm that the path is intended to implement, leading to incorrect behavior any time this path is navigated.

This weakness captures cases in which a particular code segment is always incorrect with respect to the algorithm that it is implementing. For example, if a C programmer intends to include multiple statements in a single block but does not include the enclosing braces (CWE-483), then the logic is always incorrect. This issue is in contrast to most weaknesses in which the code usually behaves correctly, except when it is externally manipulated in malicious ways.","Other; Alter Execution Logic
Scope: Other",N/A,Examine children of this entry to see if there is a better fit,N/A
697,Incorrect Comparison,DISCOURAGED,Pillar,"The product compares two entities in a security-relevant context, but the comparison is incorrect.

This Pillar covers several possibilities:

the comparison checks one factor incorrectly;
the comparison should consider multiple factors, but it does not check at least one of those factors at all;
the comparison checks the wrong factor.","Varies by Context
Scope: Other When the comparison is incorrect, it may lead to resultant weaknesses.",N/A,"Where feasible, consider children or descendants of this entry instead.",N/A
707,Improper Neutralization,DISCOURAGED,Pillar,"The product does not ensure or incorrectly ensures that structured messages or data are well-formed and that certain security properties are met before being read from an upstream component or sent to a downstream component.

If a message is malformed, it may cause the message to be incorrectly interpreted.
Neutralization is an abstract term for any technique that ensures that input (and output) conforms with expectations and is ""safe.""  This can be done by:

checking that the input/output is already ""safe"" (e.g. validation)
transformation of the input/output to be ""safe"" using techniques such as filtering, encoding/decoding, escaping/unescaping, quoting/unquoting, or canonicalization
preventing the input/output from being directly provided by an attacker (e.g. ""indirect selection"" that maps externally-provided values to internally-controlled values)
preventing the input/output from being processed at all

This weakness typically applies in cases where the product prepares a control message that another process must act on, such as a command or query, and malicious input that was intended as data, can enter the control plane instead. However, this weakness also applies to more general cases where there are not always control implications.","Other
Scope: Other",N/A,Consider children or descendants of this entry instead.,N/A
708,Incorrect Ownership Assignment,ALLOWED,Base,"The product assigns an owner to a resource, but the owner is outside of the intended control sphere.

This may allow the resource to be manipulated by actors outside of the intended control sphere.","Read Application Data; Modify Application Data
Scope: Confidentiality, Integrity An attacker could read and modify data for which they do not have permissions to access directly.",Periodically review the privileges and their owners.,Carefully read both the name and description to ensure that this mapping is an appropriate fit. Do not try to 'force' a mapping to a lower-level Base/Variant simply to comply with this preferred level of abstraction.,N/A
