ID,Title,Vulnerability_Mapping,Abstraction,Description,Impact,Mitigation,Comments,Alternate_Terms
823,Use of Out-of-range Pointer Offset,ALLOWED,Base,"The product performs pointer arithmetic on a valid pointer, but it uses an offset that can point outside of the intended range of valid memory locations for the resulting pointer.

While a pointer can contain a reference to any arbitrary memory location, a program typically only intends to use the pointer to access limited portions of memory, such as contiguous memory used to access an individual array.
Programs may use offsets in order to access fields or sub-elements stored within structured data. The offset might be out-of-range if it comes from an untrusted source, is the result of an incorrect calculation, or occurs because of another error.
If an attacker can control or influence the offset so that it points outside of the intended boundaries of the structure, then the attacker may be able to read or write to memory locations that are used elsewhere in the product. As a result, the attack might change the state of the product as accessed through program variables, cause a crash or instable behavior, and possibly lead to code execution.","Read Memory
Scope: Confidentiality If the untrusted pointer is used in a read operation, an attacker might be able to read sensitive portions of memory.

DoS: Crash, Exit, or Restart
Scope: Availability If the untrusted pointer references a memory location that is not accessible to the program, or points to a location that is ""malformed"" or larger than expected by a read or write operation, the application may terminate unexpectedly.

Execute Unauthorized Code or Commands; Modify Memory
Scope: Integrity, Confidentiality, Availability If the untrusted pointer is used in a function call, or points to unexpected data in a write operation, then code execution may be possible.",N/A,Carefully read both the name and description to ensure that this mapping is an appropriate fit. Do not try to 'force' a mapping to a lower-level Base/Variant simply to comply with this preferred level of abstraction.,"Untrusted pointer offset
                                    

This term is narrower than the concept of ""out-of-range"" offset, since the offset might be the result of a calculation or other error that does not depend on any externally-supplied values."
824,Access of Uninitialized Pointer,ALLOWED,Base,"The product accesses or uses a pointer that has not been initialized.

If the pointer contains an uninitialized value, then the value might not point to a valid memory location. This could cause the product to read from or write to unexpected memory locations, leading to a denial of service. If the uninitialized pointer is used as a function call, then arbitrary functions could be invoked. If an attacker can influence the portion of uninitialized memory that is contained in the pointer, this weakness could be leveraged to execute code or perform other attacks.
Depending on memory layout, associated memory management behaviors, and product operation, the attacker might be able to influence the contents of the uninitialized pointer, thus gaining more fine-grained control of the memory location to be accessed.","Read Memory
Scope: Confidentiality If the uninitialized pointer is used in a read operation, an attacker might be able to read sensitive portions of memory.

DoS: Crash, Exit, or Restart
Scope: Availability If the uninitialized pointer references a memory location that is not accessible to the product, or points to a location that is ""malformed"" (such as NULL) or larger than expected by a read or write operation, then a crash may occur.

Execute Unauthorized Code or Commands
Scope: Integrity, Confidentiality, Availability If the uninitialized pointer is used in a function call, or points to unexpected data in a write operation, then code execution may be possible.",N/A,Carefully read both the name and description to ensure that this mapping is an appropriate fit. Do not try to 'force' a mapping to a lower-level Base/Variant simply to comply with this preferred level of abstraction.,N/A
825,Expired Pointer Dereference,ALLOWED,Base,"The product dereferences a pointer that contains a location for memory that was previously valid, but is no longer valid.

When a product releases memory, but it maintains a pointer to that memory, then the memory might be re-allocated at a later time. If the original pointer is accessed to read or write data, then this could cause the product to read or modify data that is in use by a different function or process. Depending on how the newly-allocated memory is used, this could lead to a denial of service, information exposure, or code execution.","Read Memory
Scope: Confidentiality If the expired pointer is used in a read operation, an attacker might be able to control data read in by the application.

DoS: Crash, Exit, or Restart
Scope: Availability If the expired pointer references a memory location that is not accessible to the product, or points to a location that is ""malformed"" (such as NULL) or larger than expected by a read or write operation, then a crash may occur.

Execute Unauthorized Code or Commands
Scope: Integrity, Confidentiality, Availability If the expired pointer is used in a function call, or points to unexpected data in a write operation, then code execution may be possible.","Choose a language that provides automatic memory management.

When freeing pointers, be sure to set them to NULL once they are freed. However, the utilization of multiple or complex data structures may lower the usefulness of this strategy.",Carefully read both the name and description to ensure that this mapping is an appropriate fit. Do not try to 'force' a mapping to a lower-level Base/Variant simply to comply with this preferred level of abstraction.,Dangling pointer
915,Improperly Controlled Modification of Dynamically-Determined Object Attributes,ALLOWED,Base,"The product receives input from an upstream component that specifies multiple attributes, properties, or fields that are to be initialized or updated in an object, but it does not properly control which attributes can be modified.

If the object contains attributes that were only intended for internal use, then their unexpected modification could lead to a vulnerability.
This weakness is sometimes known by the language-specific mechanisms that make it possible, such as mass assignment, autobinding, or object injection.","Modify Application Data
Scope: Integrity An attacker could modify sensitive data or program variables.

Execute Unauthorized Code or Commands
Scope: Integrity

Varies by Context; Alter Execution Logic
Scope: Other, Integrity","If available, use features of the language or framework that allow specification of allowlists of attributes or fields that are allowed to be modified. If possible, prefer allowlists over denylists. For applications written with Ruby on Rails, use the attr_accessible (allowlist) or attr_protected (denylist) macros in each class that may be used in mass assignment.

If available, use the signing/sealing features of the programming language to assure that deserialized data has not been tainted. For example, a hash-based message authentication code (HMAC) could be used to ensure that data has not been modified.

Strategy: Input Validation For any externally-influenced input, check the input against an allowlist of internal object attributes or fields that are allowed to be modified.

Strategy: Refactoring Refactor the code so that object attributes or fields do not need to be dynamically identified, and only expose getter/setter functionality for the intended attributes.",Carefully read both the name and description to ensure that this mapping is an appropriate fit. Do not try to 'force' a mapping to a lower-level Base/Variant simply to comply with this preferred level of abstraction.,"Mass Assignment
                                    

""Mass assignment"" is the name of a feature in Ruby on Rails that allows simultaneous modification of multiple object attributes.




                                        AutoBinding
                                    

The ""Autobinding"" term is used in frameworks such as Spring MVC and ASP.NET MVC.




                                        PHP Object Injection
                                    

Some PHP application researchers use this term for attacking unsafe use of the unserialize() function, but it is also used for CWE-502."
917,Improper Neutralization of Special Elements used in an Expression Language Statement ('Expression Language Injection'),ALLOWED,Base,"The product constructs all or part of an expression language (EL) statement in a framework such as a Java Server Page (JSP) using externally-influenced input from an upstream component, but it does not neutralize or incorrectly neutralizes special elements that could modify the intended EL statement before it is executed.

Frameworks such as Java Server Page (JSP) allow a developer to insert executable expressions within otherwise-static content. When the developer is not aware of the executable nature of these expressions and/or does not disable them, then if an attacker can inject expressions, this could lead to code execution or other unexpected behaviors.","Read Application Data
Scope: Confidentiality

Execute Unauthorized Code or Commands
Scope: Integrity","Avoid adding user-controlled data into an expression interpreter when possible.

If user-controlled data must be added to an expression interpreter, one or more of the following should be performed: Validate that the user input will not evaluate as an expression Encode the user input in a way that ensures it is not evaluated as an expression

The framework or tooling might allow the developer to disable or deactivate the processing of EL expressions, such as setting the isELIgnored attribute for a JSP page to ""true"".",Carefully read both the name and description to ensure that this mapping is an appropriate fit. Do not try to 'force' a mapping to a lower-level Base/Variant simply to comply with this preferred level of abstraction.,EL Injection
922,Insecure Storage of Sensitive Information,ALLOWED,Class,"The product stores sensitive information without properly limiting read or write access by unauthorized actors.

If read access is not properly restricted, then attackers can steal the sensitive information. If write access is not properly restricted, then attackers can modify and possibly delete the data, causing incorrect results and possibly a denial of service.","Read Application Data; Read Files or Directories
Scope: Confidentiality Attackers can read sensitive information by accessing the unrestricted storage mechanism.

Modify Application Data; Modify Files or Directories
Scope: Integrity Attackers can overwrite sensitive information by accessing the unrestricted storage mechanism.",N/A,Examine children of this entry to see if there is a better fit,N/A
924,Improper Enforcement of Message Integrity During Transmission in a Communication Channel,ALLOWED,Base,"The product establishes a communication channel with an endpoint and receives a message from that endpoint, but it does not sufficiently ensure that the message was not modified during transmission.

Attackers might be able to modify the message and spoof the endpoint by interfering with the data as it crosses the network or by redirecting the connection to a system under their control.","Gain Privileges or Assume Identity
Scope: Integrity, Confidentiality If an attackers can spoof the endpoint, the attacker gains all the privileges that were intended for the original endpoint.",N/A,Carefully read both the name and description to ensure that this mapping is an appropriate fit. Do not try to 'force' a mapping to a lower-level Base/Variant simply to comply with this preferred level of abstraction.,N/A
925,Improper Verification of Intent by Broadcast Receiver,ALLOWED,Variant,"The Android application uses a Broadcast Receiver that receives an Intent but does not properly verify that the Intent came from an authorized source.

Certain types of Intents, identified by action string, can only be broadcast by the operating system itself, not by third-party applications. However, when an application registers to receive these implicit system intents, it is also registered to receive any explicit intents. While a malicious application cannot send an implicit system intent, it can send an explicit intent to the target application, which may assume that any received intent is a valid implicit system intent and not an explicit intent from another application. This may lead to unintended behavior.","Gain Privileges or Assume Identity
Scope: Integrity Another application can impersonate the operating system and cause the software to perform an unintended action.","Before acting on the Intent, check the Intent Action to make sure it matches the expected System action.",Carefully read both the name and description to ensure that this mapping is an appropriate fit. Do not try to 'force' a mapping to a lower-level Base/Variant simply to comply with this preferred level of abstraction.,Intent Spoofing
1037,Processor Optimization Removal or Modification of Security-critical Code,ALLOWED,Base,"The developer builds a security-critical protection mechanism into the software, but the processor optimizes the execution of the program such that the mechanism is removed or modified.","Bypass Protection Mechanism
Scope: Integrity Likelihood: High A successful exploitation of this weakness will change the order of an application's execution and will likely be used to bypass specific protection mechanisms. This bypass can be exploited further to potentially read data that should otherwise be unaccessible.",N/A,Carefully read both the name and description to ensure that this mapping is an appropriate fit. Do not try to 'force' a mapping to a lower-level Base/Variant simply to comply with this preferred level of abstraction.,N/A
1188,Initialization of a Resource with an Insecure Default,ALLOWED,Base,"The product initializes or sets a resource with a default that is intended to be changed by the product's installer, administrator, or maintainer, but the default is not secure.","Varies by Context
Scope: Other The impact of insecure defaults varies widely
	       depending on the functionality that the product
	       controls.",N/A,Carefully read both the name and description to ensure that this mapping is an appropriate fit. Do not try to 'force' a mapping to a lower-level Base/Variant simply to comply with this preferred level of abstraction.,N/A
1204,Generation of Weak Initialization Vector (IV),ALLOWED,Base,"The product uses a cryptographic primitive that uses an Initialization
			Vector (IV), but the product does not generate IVs that are
			sufficiently unpredictable or unique according to the expected
			cryptographic requirements for that primitive.

By design, some cryptographic primitives
			  (such as block ciphers) require that IVs
			  must have certain properties for the
			  uniqueness and/or unpredictability of an
			  IV. Primitives may vary in how important
			  these properties are. If these properties
			  are not maintained, e.g. by a bug in the
			  code, then the cryptography may be weakened
			  or broken by attacking the IVs themselves.","Read Application Data
Scope: Confidentiality If the IV is not properly initialized, data that is encrypted can be compromised and information about the data can be leaked. See [ REF-1179 ].","Different cipher
			    modes have different requirements for
			    their IVs. When choosing and implementing
			    a mode, it is important to understand
			    those requirements in order to keep
			    security guarantees intact. Generally, it
			    is safest to generate a random IV, since
			    it will be both unpredictable and have a
			    very low chance of being non-unique. IVs
			    do not have to be kept secret, so if
			    generating duplicate IVs is a concern, a
			    list of already-used IVs can be kept and
			    checked against. NIST offers recommendations on generation of IVs for modes of which they have approved. These include options for when random IVs are not practical. For CBC, CFB, and OFB, see [ REF-1175 ]; for GCM, see [ REF-1178 ].",Carefully read both the name and description to ensure that this mapping is an appropriate fit. Do not try to 'force' a mapping to a lower-level Base/Variant simply to comply with this preferred level of abstraction.,N/A
1240,Use of a Cryptographic Primitive with a Risky Implementation,ALLOWED,Base,"To fulfill the need for a cryptographic primitive, the product implements a cryptographic algorithm using a non-standard, unproven, or disallowed/non-compliant cryptographic implementation.

Cryptographic protocols and systems depend on cryptographic primitives (and associated algorithms) as their basic building blocks. Some common examples of primitives are digital signatures, one-way hash functions, ciphers, and public key cryptography; however, the notion of ""primitive"" can vary depending on point of view. See ""Terminology Notes"" for further explanation of some concepts.
Cryptographic primitives are defined to accomplish one very specific task in a precisely defined and mathematically reliable fashion. For example, suppose that for a specific cryptographic primitive (such as an encryption routine), the consensus is that the primitive can only be broken after trying out N different inputs (where the larger the value of N, the stronger the cryptography). For an encryption scheme like AES-256, one would expect N to be so large as to be infeasible to execute in a reasonable amount of time.
If a vulnerability is ever found that shows that one can break a cryptographic primitive in significantly less than the expected number of attempts, then that primitive is considered weakened (or sometimes in extreme cases, colloquially it is ""broken""). As a result, anything using this cryptographic primitive would now be considered insecure or risky. Thus, even breaking or weakening a seemingly small cryptographic primitive has the potential to render the whole system vulnerable, due to its reliance on the primitive. A historical example can be found in TLS when using DES. One would colloquially call DES the cryptographic primitive for transport encryption in this version of TLS. In the past, DES was considered strong, because no weaknesses were found in it; importantly, DES has a key length of 56 bits. Trying N=2^56 keys was considered impractical for most actors. Unfortunately, attacking a system with 56-bit keys is now practical via brute force, which makes defeating DES encryption practical. It is now practical for an adversary to read any information sent under this version of TLS and use this information to attack the system. As a result, it can be claimed that this use of TLS is weak, and that any system depending on TLS with DES could potentially render the entire system vulnerable to attack.
Cryptographic primitives and associated algorithms are only considered safe after extensive research and review from experienced cryptographers from academia, industry, and government entities looking for any possible flaws. Furthermore, cryptographic primitives and associated algorithms are frequently reevaluated for safety when new mathematical and attack techniques are discovered.  As a result and over time, even well-known cryptographic primitives can lose their compliance status with the discovery of novel attacks that might either defeat the algorithm or reduce its robustness significantly.
If ad-hoc cryptographic primitives are implemented, it is almost certain that the implementation will be vulnerable to attacks that are well understood by cryptographers, resulting in the exposure of sensitive information and other consequences.
This weakness is even more difficult to manage for hardware-implemented deployment of cryptographic algorithms. First, because hardware is not patchable as easily as software, any flaw discovered after release and production typically cannot be fixed without a recall of the product. Secondly, the hardware product is often expected to work for years, during which time computation power available to the attacker only increases. Therefore, for hardware implementations of cryptographic primitives, it is absolutely essential that only strong, proven cryptographic primitives are used.","Read Application Data
Scope: Confidentiality Likelihood: High Incorrect usage of crypto primitives could render the supposedly encrypted data as unencrypted plaintext in the worst case.","Require compliance with the strongest-available recommendations from trusted parties, and require that compliance must be kept up-to-date, since recommendations evolve over time. For example, US government systems require FIPS 140-3 certification, which supersedes FIPS 140-2 [ REF-1192 ] [ REF-267 ]. Effectiveness: High

Ensure that the architecture/design uses the strongest-available primitives and algorithms from trusted parties. For example, US government systems require FIPS 140-3 certification, which supersedes FIPS 140-2 [ REF-1192 ] [ REF-267 ]. Effectiveness: High

Do not develop custom or private cryptographic algorithms. They will likely be exposed to attacks that are well-understood by cryptographers. As with all cryptographic mechanisms, the source code should be available for analysis. If the algorithm may be compromised when attackers find out how it works, then it is especially weak. Effectiveness: Discouraged Common Practice

Try not to use cryptographic algorithms in novel ways or with new modes of operation even when you ""know"" it is secure. For example, using SHA-2 chaining to create a 1-time pad for encryption might sound like a good idea, but one should not do this. Effectiveness: Discouraged Common Practice

Ensure that the design can replace one cryptographic primitive or algorithm with another in the next generation (""cryptographic agility""). Where possible, use wrappers to make the interfaces uniform. This will make it easier to upgrade to stronger algorithms. This is especially important for hardware, which can be more difficult to upgrade quickly than software; design the hardware at a replaceable block level. Effectiveness: Defense in Depth

Do not use outdated or non-compliant cryptography algorithms. Some older algorithms, once thought to require a billion years of computing time, can now be broken in days or hours. This includes MD4, MD5, SHA1, DES, and other algorithms that were once regarded as strong [ REF-267 ]. Effectiveness: Discouraged Common Practice

Do not use a linear-feedback shift register (LFSR) or other legacy methods as a substitute for an accepted and standard Random Number Generator. Effectiveness: Discouraged Common Practice

Do not use a checksum as a substitute for a cryptographically generated hash. Effectiveness: Discouraged Common Practice

Strategy: Libraries or Frameworks Use a vetted cryptographic library or framework. Industry-standard implementations will save development time and are more likely to avoid errors that can occur during implementation of cryptographic algorithms. However, the library/framework could be used incorrectly during implementation. Effectiveness: High

When using industry-approved techniques, use them correctly. Don't cut corners by skipping resource-intensive steps ( CWE-325 ). These steps are often essential for the prevention of common attacks. Effectiveness: Moderate

Do not store keys in areas accessible to untrusted agents. Carefully manage and protect the cryptographic keys (see CWE-320 ). If the keys can be guessed or stolen, then the strength of the cryptography algorithm is irrelevant. Effectiveness: Moderate",Carefully read both the name and description to ensure that this mapping is an appropriate fit. Do not try to 'force' a mapping to a lower-level Base/Variant simply to comply with this preferred level of abstraction.,N/A
1241,Use of Predictable Algorithm in Random Number Generator,ALLOWED,Base,"The device uses an algorithm that is predictable and generates a pseudo-random number.

Pseudo-random number generator algorithms are predictable because their registers have a finite number of possible states, which eventually lead to repeating patterns. As a result, pseudo-random number generators (PRNGs) can compromise their randomness or expose their internal state to various attacks, such as reverse engineering or tampering.","Read Application Data
Scope: Confidentiality Likelihood: High","It is highly recommended to use a true random number generator (TRNG) to ensure the security of encryption schemes. Hardware-based TRNGs generate unpredictable, unbiased, and independent random numbers because they employ physical phenomena, e.g., electrical noise, as sources to generate random numbers.

It is highly recommended to use a true random number generator (TRNG) to ensure the security of encryption schemes. Hardware-based TRNGs generate unpredictable, unbiased, and independent random numbers because they employ physical phenomena, e.g., electrical noise, as sources to generate random numbers.",Carefully read both the name and description to ensure that this mapping is an appropriate fit. Do not try to 'force' a mapping to a lower-level Base/Variant simply to comply with this preferred level of abstraction.,N/A
